{
  "version": 2,
  "goal": "Add rate limiting to the public API, with per-key quotas stored in Postgres",
  "architecture": "docs/architecture.md",
  "approval": "client",
  "approvedAt": null,
  "maxParallelCrews": 4,
  "reworkAllowance": 2,
  "crews": [
    {
      "slug": "ratelimit-design",
      "stage": 0,
      "verdict": "design",
      "modules": ["gateway", "quotas"],
      "owns": [
        "docs/architecture.md",
        "docs/adr/0007-rate-limiting.md",
        "tests/contract/quota-store.test.ts"
      ],
      "acceptanceTest": "pnpm test -- tests/contract/quota-store.test.ts",
      "acceptanceTestProved": true,
      "estAgents": 5,
      "status": "planned"
    },
    {
      "slug": "quotas",
      "stage": 1,
      "verdict": "change",
      "modules": ["quotas"],
      "owns": ["src/quotas/**", "migrations/0012_quotas.sql", "tests/quotas/**"],
      "acceptanceTest": "pnpm test -- quotas",
      "acceptanceTestProved": true,
      "estAgents": 8,
      "status": "planned"
    },
    {
      "slug": "gateway",
      "stage": 1,
      "verdict": "extend",
      "modules": ["gateway"],
      "owns": ["src/gateway/middleware/ratelimit.ts", "tests/gateway/ratelimit.test.ts"],
      "acceptanceTest": "pnpm test -- gateway/ratelimit",
      "acceptanceTestProved": true,
      "estAgents": 6,
      "status": "planned"
    }
  ]
}
